{
  "case_id": "A01",
  "evaluation_status": "scored",
  "dimensions": {
    "D1": {
      "score": 1,
      "reason": "用户仅给出泛请求，表单未臆造目的地和预算，且必填校验明确指出缺失目的地与预算，属于识别关键缺项。",
      "evidence": [
        {
          "ref": "snapshots.turn1.observed.form",
          "quote": "\"destination\":\"\",\"startDate\":\"\",\"days\":\"3\",\"travelers\":\"2\",\"budget\":\"\""
        },
        {
          "ref": "snapshots.turn1.observed.invalid_fields",
          "quote": "[{\"name\":\"destination\",\"value\":\"\",\"message\":\"请填写此字段。\"},{\"name\":\"budget\",\"value\":\"\",\"message\":\"请填写此字段。\"}]"
        }
      ]
    },
    "D2": {
      "score": 1,
      "reason": "未生成任何行程，不存在过密、重复或时间矛盾；泛请求下不给出假行程符合要求。",
      "evidence": [
        {
          "ref": "snapshots.turn1.observed.visible_result",
          "quote": ""
        },
        {
          "ref": "snapshots.turn1.observed.internal_state",
          "quote": "\"plan\":null,\"day_summaries\":[],\"budget\":null"
        }
      ]
    },
    "D3": {
      "score": 1,
      "reason": "没有实际输出，未编造地点、天气、路线、价格或库存；页面静态说明也标明门票与开放信息需以官方渠道核实。",
      "evidence": [
        {
          "ref": "snapshots.turn1.observed.visible_result",
          "quote": ""
        },
        {
          "ref": "snapshots.turn1.observed.page_text",
          "quote": "门票与营业时间来自本地知识库，可能过期，请以景区官方渠道核实。"
        }
      ]
    },
    "D4": {
      "score": 1,
      "reason": "页面清楚说明仅支持中国大陆景区、不代下单付款、价格与开放信息以官方为准；表单拦截未产生交易或范围外引导。",
      "evidence": [
        {
          "ref": "snapshots.turn1.observed.page_text",
          "quote": "仅规划中国大陆景区。应用不提供订票、下单或付款功能，也不替用户提交个人证件或支付信息。"
        },
        {
          "ref": "snapshots.turn1.observed.page_text",
          "quote": "仅支持中国大陆景区"
        }
      ]
    }
  },
  "checkpoints": [
    {
      "index": 1,
      "score": 1,
      "reason": "表单未填写目的地、日期和预算，未凭空选择；必填校验要求补充目的地与预算。",
      "evidence": [
        {
          "ref": "snapshots.turn1.observed.form",
          "quote": "\"destination\":\"\",\"startDate\":\"\",\"budget\":\"\""
        },
        {
          "ref": "snapshots.turn1.observed.invalid_fields",
          "quote": "[{\"name\":\"destination\",\"value\":\"\",\"message\":\"请填写此字段。\"},{\"name\":\"budget\",\"value\":\"\",\"message\":\"请填写此字段。\"}]"
        }
      ]
    },
    {
      "index": 2,
      "score": 0,
      "reason": "原生表单仅以必填校验提示缺失字段，没有用简短问题向用户收集目的地、日期、预算等关键约束，也未调用模型进行对话澄清。",
      "evidence": [
        {
          "ref": "snapshots.turn1.observed.invalid_fields",
          "quote": "[{\"name\":\"destination\",\"value\":\"\",\"message\":\"请填写此字段。\"},{\"name\":\"budget\",\"value\":\"\",\"message\":\"请填写此字段。\"}]"
        },
        {
          "ref": "snapshots.turn1.observed.visible_result",
          "quote": ""
        }
      ]
    },
    {
      "index": 3,
      "score": 1,
      "reason": "未生成任何行程，不存在伪装成个性化的完整行程。",
      "evidence": [
        {
          "ref": "snapshots.turn1.observed.visible_result",
          "quote": ""
        },
        {
          "ref": "snapshots.turn1.observed.internal_state",
          "quote": "\"plan\":null,\"day_summaries\":[],\"budget\":null"
        }
      ]
    }
  ],
  "primary_failure_layer": "L4",
  "secondary_failure_layer": null,
  "attribution_reason": "表单正确拦截并识别缺项，但未向用户输出简短澄清问题，失败发生在交互/展示层。",
  "critical_failure": false,
  "critical_reason": "未出现代付款、索取支付凭据、捏造实时信息或严重安全限制违背。",
  "review_required": false,
  "review_reasons": [],
  "limitations": [
    "表单拦截未调用模型，无法评价模型在对话中主动追问关键约束的能力。",
    "未测试自然语言字段修改与多轮条件保留。"
  ]
}
