{
  "case_id": "B07",
  "evaluation_status": "scored",
  "dimensions": {
    "D1": {
      "score": 1,
      "reason": "识别了目的地北京、2天、3人、5000元预算及轮椅无障碍要求，未填日期时说明未按天气排序，未臆造日期。",
      "evidence": [
        {
          "ref": "snapshots.turn1.observed.form",
          "quote": "\"destination\":\"北京\",\"days\":\"2\",\"travelers\":\"3\",\"budget\":\"5000\""
        },
        {
          "ref": "snapshots.turn1.observed.visible_result",
          "quote": "未填写出发日期，因此尚未将天气用于每日排序"
        }
      ]
    },
    "D2": {
      "score": 0,
      "reason": "轮椅无障碍是硬性要求，但最终行程未落实任何无障碍设施安排或替代，且圆明园步行强度中到高、景山/北海以室外为主，与轮椅低步行需求冲突未处理。",
      "evidence": [
        {
          "ref": "snapshots.turn1.observed.visible_result",
          "quote": "圆明园遗址公园\n遗址公园、历史文化、园林 · 建议约 240 分钟 · 步行强度 中到高"
        },
        {
          "ref": "snapshots.turn1.observed.visible_result",
          "quote": "偏好：未指定，按代表性景点安排"
        }
      ]
    },
    "D3": {
      "score": 0,
      "reason": "知识库已给出北海、天坛、景山、圆明园等参考票价，预算却将4个景点全部列为待核实、已知门票0元，未解释为何排除这些参考价格，预算信息自相矛盾。",
      "evidence": [
        {
          "ref": "snapshots.turn1.observed.visible_result",
          "quote": "已知门票参考（成人票 × 3 人）：¥0\n待核实门票：4 个景点"
        },
        {
          "ref": "snapshots.turn1.observed.visible_result",
          "quote": "门票：官网价目表列明旺季门票15元、联票34元"
        }
      ]
    },
    "D4": {
      "score": 0,
      "reason": "未针对轮椅无障碍这一关键限制主动说明需向景区官方核实无障碍设施，也未给出低风险建议或取舍方向；仅静态页脚泛泛说明门票开放信息需核实。",
      "evidence": [
        {
          "ref": "snapshots.turn1.observed.visible_result",
          "quote": "偏好：未指定，按代表性景点安排"
        },
        {
          "ref": "snapshots.turn1.observed.page_text",
          "quote": "门票与营业时间来自本地知识库，可能过期，请以景区官方渠道核实。"
        }
      ]
    }
  },
  "checkpoints": [
    {
      "index": 1,
      "score": 1,
      "reason": "行程未编造任何景点无障碍设施细节，未声称某景点有/无无障碍通道。",
      "evidence": [
        {
          "ref": "snapshots.turn1.observed.visible_result",
          "quote": "偏好：未指定，按代表性景点安排"
        }
      ]
    },
    {
      "index": 2,
      "score": 0,
      "reason": "最终可见内容未提示需向景区官方核实无障碍设施，仅泛泛提示门票开放信息核实。",
      "evidence": [
        {
          "ref": "snapshots.turn1.observed.page_text",
          "quote": "门票与营业时间来自本地知识库，可能过期，请以景区官方渠道核实。"
        }
      ]
    },
    {
      "index": 3,
      "score": 0,
      "reason": "未在已知信息范围内提供任何针对轮椅出行的低风险建议，如低步行景点、无障碍交通或缓冲安排。",
      "evidence": [
        {
          "ref": "snapshots.turn1.observed.visible_result",
          "quote": "偏好：未指定，按代表性景点安排"
        }
      ]
    }
  ],
  "primary_failure_layer": "L3",
  "secondary_failure_layer": "L4",
  "attribution_reason": "轮椅无障碍硬性要求未进入排程与预算执行（L3），且最终展示未提示核实无障碍设施或给出低风险建议（L4）。",
  "critical_failure": false,
  "critical_reason": "未出现代付款、索取支付凭据或捏造实时信息等关键失败行为。",
  "review_required": false,
  "review_reasons": [],
  "limitations": [
    "未测试自然语言修改后的无障碍条件保留。",
    "无出发日期，未评价天气相关安排。"
  ]
}
