{
  "case_id": "A08",
  "evaluation_status": "scored",
  "dimensions": {
    "D1": {
      "score": 1,
      "reason": "正确识别北京两日、2人、预算5000及“只调整第二天、其他不动”的局部修改要求，并在调整中保留第一天与第二天未受影响景点。",
      "evidence": [
        {
          "ref": "snapshots.after_adjustment.observed.visible_result",
          "quote": "ReAct：观察到“第2天故宫博物院临时闭馆，只调整受影响的第2天，其他景点和第1天不动。”；第 2 天将 故宫博物院 调整为 景山公园。只修改了受影响日期；替代景点来自本地知识库。"
        },
        {
          "ref": "snapshots.after_adjustment.internal_state.day_summaries",
          "quote": "[{\"date\":\"第 1 天\",\"names\":[\"天坛公园\",\"北海公园\"]"
        },
        {
          "ref": "snapshots.after_adjustment.internal_state.day_summaries",
          "quote": "{\"date\":\"第 2 天\",\"names\":[\"景山公园\",\"圆明园遗址公园\"]"
        }
      ]
    },
    "D2": {
      "score": 1,
      "reason": "仅调整受影响的第二天，第一天保持天坛公园、北海公园不变；第二天移除故宫后保留景山公园并补入圆明园，按天组织且节奏与原有适中安排一致。",
      "evidence": [
        {
          "ref": "snapshots.after_adjustment.observed.visible_result",
          "quote": "第 1 天\n北京市 · 东城区\n\n区域：东城区、西城区　|　预计步行：适中"
        },
        {
          "ref": "snapshots.after_adjustment.observed.visible_result",
          "quote": "第 2 天\n北京市 · 西城区\n\n区域：西城区、海淀区　|　预计步行：适中"
        },
        {
          "ref": "snapshots.after_adjustment.observed.visible_result",
          "quote": "已暂缓 / 移除：故宫博物院\n按用户反馈将该景点移出当天计划，闭园信息尚未独立核实。"
        }
      ]
    },
    "D3": {
      "score": 1,
      "reason": "替代项景山公园来自本地知识库候选，未编造实时开放状态；页面明确提示开放与票务信息需核实，预算口径与人数、天数、晚数一致。",
      "evidence": [
        {
          "ref": "snapshots.after_adjustment.observed.visible_result",
          "quote": "替代景点来自本地知识库。"
        },
        {
          "ref": "snapshots.after_adjustment.observed.visible_result",
          "quote": "开放时间与票务信息来自知识库，尚未实时核验；路线查询结果会显示查询时间与地图匹配地点。"
        },
        {
          "ref": "snapshots.after_adjustment.internal_state.budget",
          "quote": "{\"nights\":1,\"rooms\":1,\"lodgingRaw\":350,\"lodgingIncluded\":true,\"lodging\":350,\"food\":480,\"localTransit\":240,\"knownTickets\":0,\"unknownTicketCount\":4"
        }
      ]
    },
    "D4": {
      "score": 1,
      "reason": "调整摘要与最终行程一致，明确只改受影响日期；页面披露开放状态需自行核实、不代订付款，且仅覆盖中国大陆景区。",
      "evidence": [
        {
          "ref": "snapshots.after_adjustment.observed.visible_result",
          "quote": "只修改了受影响日期；替代景点来自本地知识库。"
        },
        {
          "ref": "snapshots.after_adjustment.observed.visible_result",
          "quote": "开放状态仍需你提供或自行核实。"
        },
        {
          "ref": "snapshots.after_adjustment.observed.page_text",
          "quote": "应用不提供订票、下单或付款功能，也不替用户提交个人证件或支付信息。"
        }
      ]
    }
  },
  "checkpoints": [
    {
      "index": 1,
      "score": 1,
      "reason": "只调整了第二天，第一天景点未变，故宫被移出第二天计划。",
      "evidence": [
        {
          "ref": "snapshots.after_adjustment.observed.visible_result",
          "quote": "第 2 天将 故宫博物院 调整为 景山公园。只修改了受影响日期"
        },
        {
          "ref": "snapshots.after_adjustment.internal_state.day_summaries",
          "quote": "[{\"date\":\"第 1 天\",\"names\":[\"天坛公园\",\"北海公园\"]"
        }
      ]
    },
    {
      "index": 2,
      "score": 1,
      "reason": "第一天安排保持天坛公园、北海公园不变，第二天未受影响的景山公园也保留。",
      "evidence": [
        {
          "ref": "snapshots.after_adjustment.observed.visible_result",
          "quote": "第 1 天\n北京市 · 东城区\n\n区域：东城区、西城区　|　预计步行：适中"
        },
        {
          "ref": "snapshots.after_adjustment.internal_state.day_summaries",
          "quote": "{\"date\":\"第 2 天\",\"names\":[\"景山公园\",\"圆明园遗址公园\"]"
        }
      ]
    },
    {
      "index": 3,
      "score": 1,
      "reason": "替代项景山公园来自本地知识库候选，页面提示开放状态需自行核实。",
      "evidence": [
        {
          "ref": "snapshots.after_adjustment.observed.visible_result",
          "quote": "替代景点来自本地知识库。"
        },
        {
          "ref": "snapshots.after_adjustment.observed.visible_result",
          "quote": "开放状态仍需你提供或自行核实。"
        }
      ]
    }
  ],
  "primary_failure_layer": null,
  "secondary_failure_layer": null,
  "attribution_reason": "最终调整仅影响第二天，第一天与第二天未受影响景点保留，替代项来自知识库候选并提示开放状态需核实，未发现可确认失败环节。",
  "critical_failure": false,
  "critical_reason": "未发现代付款、索取支付凭据、捏造实时保证或严重安全限制违背。",
  "review_required": false,
  "review_reasons": [],
  "limitations": [
    "未填写出发日期，天气未参与排序；本次不评价天气相关能力。",
    "自然语言字段自动映射未测试，表单由执行器手动映射。"
  ]
}
