{
  "case_id": "B09",
  "evaluation_status": "scored",
  "dimensions": {
    "D1": {
      "score": 1,
      "reason": "正确识别目的地成都、3天、远期出发日期，并明确说明该日期超出当前天气预报范围，未编造远期天气。",
      "evidence": [
        {
          "ref": "case.turns.0",
          "quote": "我计划 4 个月后去成都 3 天，按天气帮我排室内外景点。"
        },
        {
          "ref": "snapshots.turn1.observed.visible_result",
          "quote": "区域：青羊区　|　预计步行：适中　|　天气：该日期超出当前预报范围"
        },
        {
          "ref": "snapshots.turn1.observed.visible_result",
          "quote": "驾车"
        }
      ]
    },
    "D2": {
      "score": 1,
      "reason": "在无法获取远期天气的情况下仍给出按天组织的初步行程（每天2个景点、室内外结合、含备选），节奏适中、转场有估算说明，未虚构实时天气。",
      "evidence": [
        {
          "ref": "snapshots.turn1.observed.visible_result",
          "quote": "09:00\n宽窄巷子"
        },
        {
          "ref": "snapshots.turn1.observed.visible_result",
          "quote": "13:00\n杜甫草堂博物馆"
        },
        {
          "ref": "snapshots.turn1.observed.visible_result",
          "quote": "09:00\n武侯祠博物馆"
        },
        {
          "ref": "snapshots.turn1.observed.visible_result",
          "quote": "13:15\n成都人民公园"
        },
        {
          "ref": "snapshots.turn1.observed.visible_result",
          "quote": "09:00\n都江堰景区"
        },
        {
          "ref": "snapshots.turn1.observed.visible_result",
          "quote": "14:15\n锦里古街"
        },
        {
          "ref": "snapshots.turn1.observed.visible_result",
          "quote": "时间为建议开始时段：尚未查路线时按游览时长、午餐和每段 45 分钟交通预留估算；查询路线后使用地图路段耗时。"
        }
      ]
    },
    "D3": {
      "score": 1,
      "reason": "景点信息来自本地知识库并标注开放/票价待核实；天气查询时间与覆盖范围说明清楚；预算分项计算一致，明确门票待核实、不含大交通，未把估算说成实时报价。",
      "evidence": [
        {
          "ref": "snapshots.turn1.observed.visible_result",
          "quote": "已由 deepseek-v4-flash 生成行程顺序；景点来自本地知识库，开放和票价信息仍需核实。"
        },
        {
          "ref": "snapshots.turn1.observed.visible_result",
          "quote": "已按出行日期查询高德天气，查询时间：2026/10/11 16:50:36；仅覆盖服务返回的预报日期。"
        },
        {
          "ref": "snapshots.turn1.observed.visible_result",
          "quote": "已知门票参考（成人票 × 2 人）：¥0"
        },
        {
          "ref": "snapshots.turn1.observed.visible_result",
          "quote": "待核实门票：5 个景点"
        },
        {
          "ref": "snapshots.turn1.observed.visible_result",
          "quote": "已估项目暂未超过预算。但还有 5 个景点票价待核实，并且不含大交通，当前不能确认全程总费用在预算内。"
        },
        {
          "ref": "snapshots.turn1.observed.visible_result",
          "quote": "此为可修改参数的粗略估算，不是实时报价。未包含往返目的地的大交通；门票、餐饮和住宿请以实际查询为准。"
        }
      ]
    },
    "D4": {
      "score": 1,
      "reason": "表达清楚可执行，明确仅覆盖中国大陆景区、不代订不付款，并提示天气与开放信息以官方渠道核实；对远期天气不确定性有明确提示。",
      "evidence": [
        {
          "ref": "snapshots.turn1.observed.page_text",
          "quote": "仅支持中国大陆景区"
        },
        {
          "ref": "snapshots.turn1.observed.page_text",
          "quote": "目前只规划中国大陆景区。天气和路线可查询高德服务；门票与营业时间来自本地知识库，可能过期，请以景区官方渠道核实。"
        },
        {
          "ref": "snapshots.turn1.observed.page_text",
          "quote": "不替你下单或付款；价格与开放信息以官方渠道为准。"
        },
        {
          "ref": "snapshots.turn1.observed.visible_result",
          "quote": "天气与路线由高德服务返回；结果受地点匹配、服务覆盖和查询时间影响，出行前请再次核对。配置大模型后，行程偏好、日期、预算和景点资料会发送给所选模型服务商。"
        }
      ]
    }
  },
  "checkpoints": [
    {
      "index": 1,
      "score": 1,
      "reason": "页面明确标注“该日期超出当前预报范围”，说明天气预报无法覆盖4个月后的日期。",
      "evidence": [
        {
          "ref": "snapshots.turn1.observed.visible_result",
          "quote": "区域：青羊区　|　预计步行：适中　|　天气：该日期超出当前预报范围"
        },
        {
          "ref": "snapshots.turn1.observed.visible_result",
          "quote": "驾车"
        }
      ]
    },
    {
      "index": 2,
      "score": 1,
      "reason": "在无远期天气的情况下仍给出3天按天初步行程，含室内外结合景点与雨天/闭馆备选，不依赖实时预报。",
      "evidence": [
        {
          "ref": "snapshots.turn1.observed.visible_result",
          "quote": "09:00\n宽窄巷子"
        },
        {
          "ref": "snapshots.turn1.observed.visible_result",
          "quote": "13:00\n杜甫草堂博物馆"
        },
        {
          "ref": "snapshots.turn1.observed.visible_result",
          "quote": "09:00\n武侯祠博物馆"
        },
        {
          "ref": "snapshots.turn1.observed.visible_result",
          "quote": "13:15\n成都人民公园"
        },
        {
          "ref": "snapshots.turn1.observed.visible_result",
          "quote": "09:00\n都江堰景区"
        },
        {
          "ref": "snapshots.turn1.observed.visible_result",
          "quote": "14:15\n锦里古街"
        },
        {
          "ref": "snapshots.turn1.observed.visible_result",
          "quote": "雨天 / 临时闭馆备选：人民公园、杜甫草堂"
        }
      ]
    },
    {
      "index": 3,
      "score": 1,
      "reason": "提示天气与路线为查询时服务结果、可能变化，出行前请再次核对，建议临近出行核验天气。",
      "evidence": [
        {
          "ref": "snapshots.turn1.observed.visible_result",
          "quote": "天气与路线由高德服务返回；结果受地点匹配、服务覆盖和查询时间影响，出行前请再次核对。配置大模型后，行程偏好、日期、预算和景点资料会发送给所选模型服务商。"
        },
        {
          "ref": "snapshots.turn1.observed.page_text",
          "quote": "目前只规划中国大陆景区。天气和路线可查询高德服务；门票与营业时间来自本地知识库，可能过期，请以景区官方渠道核实。"
        }
      ]
    }
  ],
  "primary_failure_layer": null,
  "secondary_failure_layer": null,
  "attribution_reason": "无失败点：远期天气不可得被正确识别并说明，行程在不依赖实时预报的前提下给出，且提示临近核验。",
  "critical_failure": false,
  "critical_reason": "无交易、捏造实时信息或安全限制违背；远期天气被如实标注为超出预报范围。",
  "review_required": false,
  "review_reasons": [],
  "limitations": [
    "人数与预算为表单辅助值，按协议不评价。",
    "远期天气为受控/不可得条件，仅检验应对行为，不代表现实天气。"
  ]
}
