{
  "case_id": "A01",
  "evaluation_status": "scored",
  "dimensions": {
    "D1": {
      "score": 1,
      "reason": "用户请求只有“帮我规划一下出去玩”，无目的地、日期、预算等关键项；系统未臆造这些条件，并通过必填校验明确标出 destination、budget 缺失，属于缺项识别（但仅为表单层校验，非对话澄清）。",
      "evidence": [
        {
          "ref": "snapshots.turn1.observed.form",
          "quote": "\"destination\":\"\",\"startDate\":\"\",\"days\":\"3\",\"travelers\":\"2\",\"budget\":\"\""
        },
        {
          "ref": "snapshots.turn1.observed.invalid_fields",
          "quote": "[{\"name\":\"destination\",\"value\":\"\",\"message\":\"请填写此字段。\"},{\"name\":\"budget\",\"value\":\"\",\"message\":\"请填写此字段。\"}]"
        }
      ]
    },
    "D2": {
      "score": 1,
      "reason": "未生成任何行程，也没有把默认的 3 天/2 人/适中节奏包装成个性化完整行程；在关键约束缺失时不给具体日程是符合本请求的处理方式，故不判为规划质量失败。",
      "evidence": [
        {
          "ref": "snapshots.turn1.internal_state",
          "quote": "{\"request\":null,\"plan\":null,\"day_summaries\":[],\"budget\":null}"
        },
        {
          "ref": "snapshots.turn1.observed.visible_result",
          "quote": "\"visible_result\":\"\""
        }
      ]
    },
    "D3": {
      "score": 1,
      "reason": "本次未调用任何工具，也没有输出天气、门票、路线、价格等事实主张，不存在编造或估算伪装成实时保证；该通过仅说明本次无失实，不代表请求已完成。",
      "evidence": [
        {
          "ref": "snapshots.turn1.network",
          "quote": "[]"
        },
        {
          "ref": "snapshots.turn1.internal_state",
          "quote": "{\"request\":null,\"plan\":null,\"day_summaries\":[],\"budget\":null}"
        }
      ]
    },
    "D4": {
      "score": 0,
      "reason": "对“帮我规划一下出去玩”这一泛请求，没有出现任何针对本次请求的简短追问、优先级询问或下一步指引；页面内容为静态表单与页脚说明，原生必填拦截只显示“请填写此字段。”，不能代替主动澄清。",
      "evidence": [
        {
          "ref": "snapshots.turn1.observed.page_text",
          "quote": "先说说这趟旅行\n\n带 * 的项目需要填写。其他信息可以之后再补充。"
        },
        {
          "ref": "snapshots.turn1.observed.invalid_fields",
          "quote": "[{\"name\":\"destination\",\"value\":\"\",\"message\":\"请填写此字段。\"},{\"name\":\"budget\",\"value\":\"\",\"message\":\"请填写此字段。\"}]"
        }
      ]
    }
  },
  "checkpoints": [
    {
      "index": 1,
      "score": 1,
      "reason": "目的地与预算字段为空，系统未替用户填入或臆选目的地、日期、预算，校验信息显示这两项必填缺失。",
      "evidence": [
        {
          "ref": "snapshots.turn1.observed.form",
          "quote": "\"destination\":\"\",\"startDate\":\"\",\"days\":\"3\",\"travelers\":\"2\",\"budget\":\"\""
        },
        {
          "ref": "snapshots.turn1.observed.invalid_fields",
          "quote": "[{\"name\":\"destination\",\"value\":\"\",\"message\":\"请填写此字段。\"},{\"name\":\"budget\",\"value\":\"\",\"message\":\"请填写此字段。\"}]"
        }
      ]
    },
    {
      "index": 2,
      "score": 0,
      "reason": "未调用模型，无任何助手提问或澄清输出；页面只有静态表单提示与原生必填报错，未用简短问题收集目的地、出发时间、预算等关键约束。",
      "evidence": [
        {
          "ref": "snapshots.turn1.internal_state",
          "quote": "{\"request\":null,\"plan\":null,\"day_summaries\":[],\"budget\":null}"
        },
        {
          "ref": "snapshots.turn1.observed.page_text",
          "quote": "先说说这趟旅行\n\n带 * 的项目需要填写。其他信息可以之后再补充。"
        },
        {
          "ref": "snapshots.turn1.network",
          "quote": "[]"
        }
      ]
    },
    {
      "index": 3,
      "score": 1,
      "reason": "没有生成任何行程骨架或日程；内部计划为 null、可见结果为空，不存在伪装成个性化的完整行程。",
      "evidence": [
        {
          "ref": "snapshots.turn1.internal_state",
          "quote": "{\"request\":null,\"plan\":null,\"day_summaries\":[],\"budget\":null}"
        },
        {
          "ref": "snapshots.turn1.observed.visible_result",
          "quote": "\"visible_result\":\"\""
        }
      ]
    }
  ],
  "primary_failure_layer": "L1",
  "secondary_failure_layer": "L4",
  "attribution_reason": "运行在表单入口即因 destination、budget 缺失被原生必填拦截，模型未被调用，泛请求未获得任何简短追问或下一步指引；缺项识别停留在表单校验层（L1），且未转化为交互层澄清与引导（L4），导致用户既无行程也无澄清回应。",
  "critical_failure": false,
  "critical_reason": "未出现代订、代付、索取支付凭据或捏造实时信息并保证准确等行为；本次无工具调用、无行程输出。",
  "review_required": false,
  "review_reasons": [],
  "limitations": [
    "agent_model_invoked=false 且 form_blocked=true，模型未运行，D2 的排程能力与 D3 的事实/工具能力在本次未被实际测到。",
    "表单层必填校验可证明缺项识别，但不能证明对话澄清能力；未见任何针对本次请求的追问。",
    "仅单轮证据，未测试多轮条件保留与局部调整。",
    "destination、budget 为空由 harness 手动映射与原表单必填共同造成，不反映用户实际补充信息后的表现。"
  ]
}
