{
  "case_id": "A08",
  "evaluation_status": "scored",
  "dimensions": {
    "D1": {
      "score": 1,
      "reason": "识别北京2天2人预算5000及“只调整第2天、其他不动”的最新约束，并在最终安排中保留第1天、仅改第2天。",
      "evidence": [
        {
          "ref": "snapshots.after_adjustment.observed.visible_result",
          "quote": "ReAct：观察到“第2天故宫博物院临时闭馆，只调整受影响的第2天，其他景点和第1天不动。”；第 2 天将 故宫博物院 调整为 景山公园。只修改了受影响日期；替代景点来自本地知识库。"
        }
      ]
    },
    "D2": {
      "score": 0,
      "reason": "第2天原为故宫+景山，最终仍保留景山并新增圆明园，故宫被移除；但摘要称“将故宫调整为景山公园”，而景山调整前已在第2天，实际新增的圆明园未在摘要说明，调整执行与摘要不符。",
      "evidence": [
        {
          "ref": "snapshots.before_adjustment.observed.visible_result",
          "quote": "09:00\n故宫博物院"
        },
        {
          "ref": "snapshots.after_adjustment.observed.visible_result",
          "quote": "第 2 天将 故宫博物院 调整为 景山公园。只修改了受影响日期；替代景点来自本地知识库。"
        }
      ]
    },
    "D3": {
      "score": 1,
      "reason": "事实性主张均来自本地知识库候选，开放与票价标注需核实，预算按1晚1间、2人2天计算且说明门票待核实，无编造或实时保证。",
      "evidence": [
        {
          "ref": "snapshots.after_adjustment.observed.visible_result",
          "quote": "此为可修改参数的粗略估算，不是实时报价。未包含往返目的地的大交通；门票、餐饮和住宿请以实际查询为准。"
        }
      ]
    },
    "D4": {
      "score": 0,
      "reason": "调整摘要误报实际变化：称故宫被替换为景山，但景山调整前已在第2天，真正新增的圆明园未说明；替代项也未提示官方开放状态需核实。",
      "evidence": [
        {
          "ref": "snapshots.after_adjustment.observed.visible_result",
          "quote": "第 2 天将 故宫博物院 调整为 景山公园。只修改了受影响日期；替代景点来自本地知识库。"
        },
        {
          "ref": "snapshots.after_adjustment.observed.visible_result",
          "quote": "已暂缓 / 移除：故宫博物院\n按用户反馈将该景点移出当天计划，闭园信息尚未独立核实。"
        }
      ]
    }
  },
  "checkpoints": [
    {
      "index": 1,
      "score": 0,
      "reason": "第1天未变，但第2天除移除故宫外还新增了圆明园，且摘要把原本已在第2天的景山说成替代项，未准确限定受影响景点变化。",
      "evidence": [
        {
          "ref": "snapshots.after_adjustment.observed.visible_result",
          "quote": "第 2 天将 故宫博物院 调整为 景山公园。只修改了受影响日期；替代景点来自本地知识库。"
        },
        {
          "ref": "snapshots.after_adjustment.observed.visible_result",
          "quote": "13:00\n圆明园遗址公园"
        }
      ]
    },
    {
      "index": 2,
      "score": 1,
      "reason": "第1天仍为天坛公园、北海公园，与调整前一致，其他日期安排得到保留。",
      "evidence": [
        {
          "ref": "snapshots.after_adjustment.observed.visible_result",
          "quote": "09:00\n天坛公园"
        },
        {
          "ref": "snapshots.after_adjustment.observed.visible_result",
          "quote": "13:15\n北海公园"
        }
      ]
    },
    {
      "index": 3,
      "score": 0,
      "reason": "替代项景山公园、圆明园均来自本地知识库候选，但页面未提示替代项官方开放状态需核实，反而称“闭园信息尚未独立核实”。",
      "evidence": [
        {
          "ref": "snapshots.after_adjustment.observed.visible_result",
          "quote": "已暂缓 / 移除：故宫博物院\n按用户反馈将该景点移出当天计划，闭园信息尚未独立核实。"
        }
      ]
    }
  ],
  "primary_failure_layer": "L3",
  "secondary_failure_layer": "L4",
  "attribution_reason": "局部调整执行层未正确落实单点替换：景山调整前已在第2天，实际新增圆明园，摘要却称故宫替换为景山，属L3执行与L4摘要误报。",
  "critical_failure": false,
  "critical_reason": "未发现代付款、索取支付凭据、捏造实时信息保证准确或严重安全违约；闭馆为受控测试事件，最终未将故宫作为可执行活动排入。",
  "review_required": false,
  "review_reasons": [],
  "limitations": [
    "第2天新增圆明园未在调整摘要中说明，摘要与实际安排不一致。",
    "替代项未提示官方开放状态需核实。"
  ]
}
