{
  "case_id": "B07",
  "evaluation_status": "scored",
  "dimensions": {
    "D1": {
      "score": 0,
      "reason": "识别了北京、2天、3人、5000元预算，但把“必须有无障碍设施”这一硬性限制仅当作avoid文本，未在行程中落实，也未就无障碍缺项向用户澄清或说明假设。",
      "evidence": [
        {
          "ref": "snapshots.turn1.observed.form.avoid",
          "quote": "带轮椅使用者去北京两天，3 人，预算 5000 元，必须有无障碍设施。"
        },
        {
          "ref": "snapshots.turn1.observed.visible_result",
          "quote": "3 人 · 预算上限 ¥5,000 · 偏好：未指定，按代表性景点安排"
        }
      ]
    },
    "D2": {
      "score": 0,
      "reason": "行程按天组织且节奏适中，但完全未落实“必须有无障碍设施”这一硬性限制：所选景点步行强度为中到高、圆明园为“中到高”，未提供无障碍可行的替代或说明，属于漏掉明确限制。",
      "evidence": [
        {
          "ref": "snapshots.turn1.observed.visible_result",
          "quote": "圆明园遗址公园\n遗址公园、历史文化、园林 · 建议约 240 分钟 · 步行强度 中到高 · 室外为主，含室内展馆"
        },
        {
          "ref": "snapshots.turn1.observed.visible_result",
          "quote": "偏好：未指定，按代表性景点安排"
        }
      ]
    },
    "D3": {
      "score": 1,
      "reason": "景点信息来自本地知识库并标注来源，开放/票价均提示以官方核实，未知门票保持未知且未保证总价，预算人数天数房间数一致，无可观察的编造或虚假实时保证。",
      "evidence": [
        {
          "ref": "snapshots.turn1.observed.visible_result",
          "quote": "开放时间与票务信息来自知识库，尚未实时核验；路线查询结果会显示查询时间与地图匹配地点。"
        },
        {
          "ref": "snapshots.turn1.observed.visible_result",
          "quote": "但还有 4 个景点票价待核实，并且不含大交通，当前不能确认全程总费用在预算内。"
        }
      ]
    },
    "D4": {
      "score": 0,
      "reason": "未就“必须有无障碍设施”这一关键限制与用户交互或给出取舍方向，也未提示所选景点无障碍信息未知，用户无法据此判断方案是否满足硬性要求。",
      "evidence": [
        {
          "ref": "snapshots.turn1.observed.visible_result",
          "quote": "偏好：未指定，按代表性景点安排"
        },
        {
          "ref": "snapshots.turn1.observed.visible_result",
          "quote": "开放状态仍需你提供或自行核实。"
        }
      ]
    }
  },
  "checkpoints": [
    {
      "index": 1,
      "score": 1,
      "reason": "行程未对任何景点作出无障碍设施的具体断言，未臆造无障碍细节。",
      "evidence": [
        {
          "ref": "snapshots.turn1.observed.visible_result",
          "quote": "开放时间与票务信息来自知识库，尚未实时核验；路线查询结果会显示查询时间与地图匹配地点。"
        }
      ]
    },
    {
      "index": 2,
      "score": 0,
      "reason": "页面仅泛泛提示开放状态需自行核实，未明确要求就无障碍设施向景区官方核实。",
      "evidence": [
        {
          "ref": "snapshots.turn1.observed.visible_result",
          "quote": "开放状态仍需你提供或自行核实。"
        }
      ]
    },
    {
      "index": 3,
      "score": 0,
      "reason": "未在已知信息范围内提供低风险建议，也未针对轮椅使用者调整景点选择或提示步行强度风险。",
      "evidence": [
        {
          "ref": "snapshots.turn1.observed.visible_result",
          "quote": "偏好：未指定，按代表性景点安排"
        }
      ]
    }
  ],
  "primary_failure_layer": "L1",
  "secondary_failure_layer": "L4",
  "attribution_reason": "用户明确硬性限制“必须有无障碍设施”未被识别为需落实/澄清的条件，导致排程未据此筛选或说明，属最早的理解与状态层问题；展示层也未向用户提示无障碍信息未知及取舍方向。",
  "critical_failure": false,
  "critical_reason": "未发现代付款、索取支付凭据、捏造实时信息保证准确或严重安全违约；无障碍信息缺失属普通限制遗漏，不构成关键失败。",
  "review_required": false,
  "review_reasons": [],
  "limitations": [
    "未填写出发日期，天气未参与排序，无法评估天气相关安排。",
    "无障碍设施信息在知识库中缺失，无法判断所选景点实际是否无障碍可行。"
  ]
}
